序号,题名,作者,来源,发表时间,数据库,被引,下载
1570,产业共生:理论界定及其内在机理,胡晓鹏,中国工业经济,2008-09-17,期刊,150,2684
1571,中国A级旅游景区空间分布结构研究,朱竑 陈晓亮,地理科学,2008-10-15,期刊,159,3371
1572,人民币汇率的价格传递效应——基于VAR模型的实证分析,陈六傅 刘厚俊,金融研究,2007-04-25,期刊,473,9622
1573,独立董事能否抑制大股东的“掏空”?,叶康涛 陆正飞 张志华,经济研究,2007-04-20,期刊,532,8916
1574,收入流动性和收入分配:来自中国农村的经验证据,章奇 米建伟 黄季焜,经济研究,2007-11-20,期刊,134,4245
1575,企业规模、市场力量与创新:一个文献综述,吴延兵,经济研究,2007-05-20,期刊,207,10588
1576,东亚经济增长模式相关争论的再探讨,林毅夫 任若恩,经济研究,2007-08-20,期刊,331,9094
1577,政府规模、法治水平与服务业发展,汪德华 张再金 白重恩,经济研究,2007-06-20,期刊,229,4535
1578,资产减值:稳健性还是盈余管理,代冰彬 陆正飞 张然,会计研究,2007-12-15,期刊,254,7252
1579,集团化运作、融资约束与财务风险——基于上海复星集团案例研究,李焰 陈才东 黄磊,管理世界,2007-12-15,期刊,158,8203
1580,上市公司信息披露质量提升能否改进公司绩效?——基于2002—2005年深市上市公司的经验证据,张宗新 杨飞 袁庆海,会计研究,2007-10-15,期刊,346,6707
1581,产业融合发展研究,郑明高,北京交通大学,2010-03-01,博士,77,5509
1582,新能源汽车技术经济综合评价及其发展策略研究,阮娴静,武汉理工大学,2010-05-18,博士,67,11852
1583,在线评论对消费者感知与购买行为影响的实证研究,郝媛媛,哈尔滨工业大学,2010-06-01,博士,63,6723
1584,中国城镇地区的组内工资差距:1995—2007,邢春冰 李实,经济学(季刊),2010-10-15,期刊,23,1501
1585,终极控股股东控制权与全流通背景下的大股东减持,俞红海 徐龙炳,财经研究,2010-01-03,期刊,73,1991
1586,基于公路网络的长江三角洲旅游景点可达性格局研究,靳诚 陆玉麒 范黎丽,自然资源学报,2010-02-15,期刊,71,1297
1587,消费者食品安全风险认知研究——基于三聚氰胺事件下南京消费者的调查,周应恒 卓佳,农业技术经济,2010-02-26,期刊,101,2198
1588,从国际公共产品到区域性公共产品——区域合作理论的新增长点,樊勇明,世界经济与政治,2010-01-14,期刊,78,2402
1589,现阶段农地流转市场能减轻土地细碎化程度吗?——来自江苏兴化和黑龙江宾县的初步证据,钟甫宁 王兴稳,农业经济问题,2010-01-23,期刊,60,1914
1590,我国能源利用现状与对策,许红星,中外能源,2010-01-15,期刊,158,4596
1591,成本推动型通货膨胀的含义、甄别和反通货膨胀政策:一个文献研究,范志勇,世界经济,2010-01-10,期刊,34,2170
1592,中国入境游客旅游消费总体趋势与区域差异:1996～2005年,席建超 甘萌雨 吴普 葛全胜,地理研究,2010-04-15,期刊,43,1780
1593,基于距离协调度模型的系统协调发展定量评价方法,汤铃 李建平 余乐安 覃东海,系统工程理论与实践,2010-04-15,期刊,138,1806
1594,基于多群组结构方程模型视角的绿色购买行为影响因素分析——来自东部、中部、西部的数据,张连刚,中国农村经济,2010-02-28,期刊,44,2041
1595,研发创新绩效评价的国际比较研究,罗亚非 王海峰 范小阳,数量经济技术经济研究,2010-03-05,期刊,45,1431
1596,跟踪国际  主动参与  积极应对  深入研究金融工具会计最新动向与对策——财政部金融工具会计工作组第二次会议综述,陆建桥 朱琳,会计研究,2010-02-15,期刊,62,1636
1597,中国生态农业的发展与展望,李文华 刘某承 闵庆文,资源科学,2010-06-15,期刊,64,4764
1598,FASB和IASB有关《公允价值计量》会计准则研究的最新动态述评,谢诗芬 戴子礼 廖雅琴,当代财经,2010-05-15,期刊,80,3008
1599,主客交往偏好对目的地形象和游客满意度的影响——以广西阳朔为例,张宏梅 陆林,地理研究,2010-06-15,期刊,39,1590
1600,金融危机对中国出口贸易影响的实证分析,胡求光 李洪英,国际贸易问题,2010-03-15,期刊,66,1930
1601,新会计准则下利润信息的合理使用——合并报表净利润与母公司报表净利润之选择,陆正飞 张会丽,会计研究,2010-04-15,期刊,44,3792
1602,中国中部地区承接产业转移的行业选择,贺清云 蒋菁 何海兵,经济地理,2010-06-26,期刊,106,2680
1603,使用者成本、住房按揭贷款与房地产市场有效需求,孔行 刘治国 于渤,金融研究,2010-01-25,期刊,52,1941
1604,中国市场一体化与区域经济增长互动:1995～2007年,柯善咨 郭素梅,数量经济技术经济研究,2010-05-05,期刊,46,1317
1605,职场排斥对员工职外绩效的影响:组织认同和工作投入的中介效应,李锐,管理科学,2010-06-20,期刊,66,2569
1606,基于损害和成本的环境污染损失核算——以山东省为例,杨丹辉 李红莉,中国工业经济,2010-07-17,期刊,39,1460
1607,产业链整合、专用性投资与合作剩余分配:来自温氏模式的例证,万俊毅 欧晓明,中国农村经济,2010-05-30,期刊,32,1768
1608,中国工业部门劳动收入份额的变动研究:1997～2008年,翁杰 周礼,中国人口科学,2010-08-01,期刊,45,951
1609,我国区域旅游空间结构演化的微观机理与动态模拟研究,薛领 翁瑾,旅游学刊,2010-08-06,期刊,52,2020
1610,人民币实际汇率和人口年龄结构,杨长江 皇甫秉超,金融研究,2010-02-25,期刊,41,1961
1611,中国人力资本存量估算:1978—2007,焦斌龙 焦志明,经济学家,2010-09-05,期刊,88,2478
1612,一体化、外包与经济演进:超边际-新兴古典一般均衡分析,庞春,经济研究,2010-03-20,期刊,27,2799
1613,中国省级电信业技术效率:区域差异及影响因素,李再扬 杨少华,中国工业经济,2010-08-17,期刊,36,948
1614,农业“走出去”背景下中国与中亚五国农业合作前景分析,李豫新 朱新鑫,农业经济问题,2010-09-23,期刊,57,1627
1615,新产品开发中的消费者创意——产品创新任务和消费者知识对消费者产品创意的影响,汪涛 何昊 诸凡,管理世界,2010-02-15,期刊,40,3203
1616,黄淮海平原农区典型村庄用地扩展及其动力机制,王介勇 刘彦随 陈玉福,地理研究,2010-10-15,期刊,46,1037
1617,中国制造业地理集聚的时空演变特征分析:1980-2008,吴三忙 李善同,财经研究,2010-10-03,期刊,56,1235
1618,基于企业本质的企业社会责任边界研究,李伟阳,中国工业经济,2010-09-17,期刊,27,2096
1619,中国管理学案例研究:综述与评估,李茁新 陆强,科研管理,2010-09-20,期刊,46,3468
1620,农村居民医疗服务满意度影响因素分析,王延中 江翠萍,中国农村经济,2010-08-30,期刊,46,1775
1621,供给冲击、需求冲击与经济周期效应——基于中国数据的实证分析,黄桂田 赵留彦,金融研究,2010-05-25,期刊,34,2314
1622,我国上市公司产融结合效果分析——基于参股非上市金融机构视角的实证研究,蔺元,南开管理评论,2010-10-08,期刊,54,1788
1623,移动即时通讯服务持续使用意向影响因素研究,李蒙翔 顾睿 尚小文 王刊良,管理科学,2010-10-20,期刊,54,1517
1624,我国城镇正规就业与非正规就业的工资差异,常进雄 王丹枫,数量经济技术经济研究,2010-09-05,期刊,30,1350
1625,中国的财政支出与城乡收入差距,陈安平 杜金沛,统计研究,2010-11-15,期刊,77,2124
1626,我国农村产权抵押融资制度改革的问题与前景——基于成都市相关新政的分析,邓纲,农业经济问题,2010-11-23,期刊,53,1267
1627,企业知识网络能力的理论架构和提升路径,李贞 张体勤,中国工业经济,2010-10-17,期刊,28,1579
1628,中国工业部门能源反弹效应研究,国涓 郭崇慧 凌煜,数量经济技术经济研究,2010-11-05,期刊,38,900
1629,独立董事辞职行为的信息含量,张俊生 曾亚敏,金融研究,2010-08-25,期刊,34,1885
1630,银行治理、治理机制与治理风险——首届银行治理研讨会综述,曹廷求 张光利 位华 李维安,经济研究,2010-09-20,期刊,28,2508
1631,独立董事监督中的动机——基于独立意见的经验证据,唐雪松 申慧 杜军,管理世界,2010-09-15,期刊,42,2541
1632,资本流动、货币政策与通货膨胀动态,黄志刚,经济学(季刊),2010-07-31,期刊,26,1891
1633,劳动合同对于进城务工人员收入影响的有效性分析,陈祎 刘阳阳,经济学(季刊),2010-01-15,期刊,40,1193
1634,品牌理论里程碑探析,卢泰宏 吴水龙 朱辉煌 何云,外国经济与管理,2009-01-20,期刊,158,4894
1635,从全球金融危机看我国银行业金融创新的进一步发展问题,李翰阳,国际金融研究,2009-02-12,期刊,92,4527
1636,制造业企业区位选择与南京城市空间重构,吕卫国 陈雯,地理学报,2009-02-15,期刊,89,2302
1637,中国企业海外市场进入模式选择研究,黄速建 刘建丽,中国工业经济,2009-01-17,期刊,95,3444
1638,可持续生计分析框架下农户生计资本的调查与分析——以南水北调(中线)工程库区为例,杨云彦 赵锋,农业经济问题,2009-03-23,期刊,156,2401
1639,我国纯电动汽车的发展方向及能源供给模式的探讨,张文亮 武斌 李武峰 来小康,电网技术,2009-02-20,期刊,383,6139
1640,中国经济发展阶段的评价及现阶段的特征分析,梁炜 任保平,数量经济技术经济研究,2009-04-05,期刊,72,3104
1641,中国出口贸易的能耗效应和环境效应的实证分析——基于混合单位投入产出模型,孙小羽 臧新,数量经济技术经济研究,2009-04-05,期刊,102,1915
1642,基于DEA的中国特大城市资源效率及其变化,郭腾云 徐勇 王志强,地理学报,2009-04-15,期刊,102,2002
1643,国际服务贸易影响因素与我国服务贸易国际竞争力研究,殷凤 陈宪,国际贸易问题,2009-02-15,期刊,161,7221
1644,人民币国际化进程对我国经济的影响,马荣华,国际金融研究,2009-04-12,期刊,98,9471
1645,多元化企业集团管理控制体系的整合观——基于华润集团6S的案例分析,汤谷良 王斌 杜菲 付阳,会计研究,2009-02-15,期刊,73,5079
1646,员工合理化建议的多层次分析:来自本土连锁超市的证据,梁建 唐京,南开管理评论,2009-06-08,期刊,127,1349
1647,手机银行用户采纳的影响因素研究,谢滨 林轶君 郭迅华,南开管理评论,2009-06-08,期刊,113,3018
1648,城市农民工的就业稳定性及其工资效应,黄乾,人口研究,2009-05-29,期刊,90,1750
1649,非活跃市场条件下金融工具计量问题研究,潘秀丽,会计研究,2009-03-15,期刊,82,1987
1650,转型期中国城市贫困和剥夺的空间模式,袁媛 吴缚龙 许学强,地理学报,2009-06-15,期刊,65,2281
1651,结构转型与巴拉萨-萨缪尔森效应,王泽填 姚洋,世界经济,2009-04-10,期刊,83,2284
1652,农民专业合作社绩效评价体系及其验证,徐旭初,农业技术经济,2009-07-26,期刊,136,2088
1653,城市土地集约利用国内外研究进展,朱天明 杨桂山 万荣荣,经济地理,2009-06-26,期刊,168,4942
1654,公众学习、预期引导与货币政策的有效性,徐亚平,金融研究,2009-01-25,期刊,87,1759
1655,中国区域经济收敛的空间计量分析——基于长三角1993-2006年132个县市区的实证研究,张学良,财经研究,2009-07-03,期刊,106,3144
1656,供给配给与需求压抑交互影响下的正规信贷约束:来自1874户农户金融需求行为考察,程郁 韩俊 罗丹,世界经济,2009-05-10,期刊,110,1633
1657,淮海经济区经济发展差异研究,孙姗姗 朱传耿 李志江,地理学报,2009-08-15,期刊,63,1709
1658,农村金融制度中的信贷担保物:困境与出路,高圣平 刘萍,金融研究,2009-02-25,期刊,110,2516
1659,信贷配给下农户借贷的福利效果分析,褚保金 卢亚娟 张龙耀,中国农村经济,2009-06-30,期刊,95,1644
1660,资本和部门下乡与小农户经济的组织化道路——兼对专业合作社道路提出质疑,仝志辉 温铁军,开放时代,2009-04-10,期刊,158,2284
1661,公司信息透明度与大股东资金占用研究,王克敏 姬美光 李薇,南开管理评论,2009-08-08,期刊,97,1819
1662,审计委员会与信息披露质量:来自中国上市公司的经验证据,蔡卫星 高明华,南开管理评论,2009-08-08,期刊,104,2389
1663,股权控制链、代理冲突与审计师选择,王烨,会计研究,2009-06-15,期刊,69,1986
1664,低碳经济与科学发展,冯之浚 牛文元,中国软科学,2009-08-28,期刊,347,3020
1665,产学研合作技术创新模式分析,仲伟俊 梅姝娥 谢园园,中国软科学,2009-08-28,期刊,182,4931
1666,土地利用空间优化配置研究进展与展望,罗鼎 月卿 邵晓梅 王静,地理科学进展,2009-09-15,期刊,106,3368
1667,基于网络层次分析法的电力客户满意度模糊综合评价,周黎莎 于新华,电网技术,2009-09-05,期刊,106,2290
1668,高速成长的营销神话——基于中国10家成功企业的多案例研究,李飞 王高 杨斌 马宝龙 林健 赵俊霞 陈浩,管理世界,2009-02-15,期刊,67,6255
1669,公平信息披露的经济后果——基于收益波动性、信息泄露及寒风效应的实证研究,朱红军 汪辉,管理世界,2009-02-15,期刊,72,3240
1670,中国上市公司发行短期融资券的影响因素分析,吴育辉 魏志华 吴世农,金融研究,2009-05-25,期刊,57,2728
1671,本轮国内价格波动的外部冲击因素考察,纪敏,金融研究,2009-06-25,期刊,81,1112
1672,中国企业社会责任及其对企业社会资本影响的实证研究,徐尚昆 杨汝岱,中国软科学,2009-11-28,期刊,100,3032
1673,公司治理影响信息披露了吗?——对中英资本市场的实证比较研究,谭兴民 宋增基 蒲勇健,金融研究,2009-07-18,期刊,62,2421
1674,长三角区域经济一体化进程的社会网络分析,侯赟慧 刘志彪 岳中刚,中国软科学,2009-12-28,期刊,99,3177
1675,高层管理团队内部社会资本、团队冲突和决策效果的关系——研究综述与理论分析框架,陈璐 杨百寅 井润田 刘璞,南开管理评论,2009-12-08,期刊,59,3268
1676,我国服务业生产率及其影响因素分析——基于随机前沿生产函数的实证研究,杨青青 苏秦 尹琳琳,数量经济技术经济研究,2009-12-05,期刊,55,2062
1677,我国股票市场和外汇市场波动溢出效应分析,陈国进 许德学 陈娟,数量经济技术经济研究,2009-12-05,期刊,70,1660
1678,美联储“量化宽松”货币政策的原因、影响与启示,王树同 刘明学 栾雪剑,国际金融研究,2009-11-12,期刊,79,3223
1679,政府消费与私人消费关系研究:基于面板单位根检验及面板协整分析,杨子晖 温雪莲 陈浪南,世界经济,2009-11-10,期刊,48,2498
1680,股权分置改革、管理层激励与企业效率:基于上市公司行业数据的经验分析,姚伟峰 鲁桐 何枫,世界经济,2009-12-10,期刊,64,1877
1681,垂直专业化与中国制造业贸易竞争力,文东伟 冼国明,中国工业经济,2009-06-17,期刊,84,1919
1682,股改方案、代理成本与大股东解禁股出售,贾明 张喆 万迪昉,管理世界,2009-09-15,期刊,49,2181
1683,异质性企业贸易模型对中国企业出口的适用性检验,唐宜红 林发勤,南开经济研究,2009-12-22,期刊,114,1459
1684,灾难风险与中国城镇居民财产分布,陈彦斌 霍震 陈军,经济研究,2009-11-20,期刊,40,1826
1685,有目标的电价补贴有助于能源公平和效率,林伯强 蒋竺均 林静,金融研究,2009-11-25,期刊,43,1470
1686,政府收入、税收结构与中国经济增长,何茵 沈明高,金融研究,2009-09-25,期刊,63,1691
1687,基于FDH方法的中国商业银行X-效率研究,邱兆祥 张爱武,金融研究,2009-11-25,期刊,61,1370
1688,国有银行治理结构与管理层激励——多项任务委托代理、经理人市场和优先股,李波 单漫与,金融研究,2009-10-25,期刊,55,2581
1689,治理结构对家族股东隧道行为的影响分析,申明浩,经济研究,2008-06-20,期刊,120,3054
1690,影响我国企业对外直接投资因素研究,张为付,中国工业经济,2008-11-17,期刊,108,3655
1691,我国农村地区金融排斥研究,许圣道 田霖,金融研究,2008-07-25,期刊,150,2717
1692,参数异质性、经济趋同与中国区域经济发展,周业安 章泉,经济研究,2008-01-20,期刊,104,3027
1693,地方官员来源、去向、任期与经济增长——来自中国省长省委书记的证据,王贤彬 徐现祥,管理世界,2008-03-15,期刊,230,4627
1694,结构调整能否改善能源效率:基于中国省级数据的研究,魏楚 沈满洪,世界经济,2008-11-10,期刊,170,2266
1695,国际贸易、FDI和中国全要素生产率下降——基于1952～2006年面板数据的DEA和协整检验,刘舜佳,数量经济技术经济研究,2008-11-05,期刊,140,3671
1696,并购价值创造的影响因素研究,周小春 李善民,管理世界,2008-05-15,期刊,195,5864
1697,机构投资者介入公司治理效果的实证研究——基于CCGI~(NK)的经验研究,李维安 李滨,南开管理评论,2008-02-08,期刊,438,4702
1698,中国国债利率期限结构模型研究与实证分析,周子康 王宁 杨衡,金融研究,2008-02-18,期刊,110,4028
1699,董事会独立性、股权制衡与财务信息质量,王跃堂 朱林 陈世敏,会计研究,2008-01-15,期刊,257,4667
1700,中国利率期限结构的货币政策含义,郭涛 宋德勇,经济研究,2008-03-20,期刊,171,4488
1701,审计市场结构与审计质量:来自中国证券市场的经验证据,刘桂良 牟谦,会计研究,2008-06-15,期刊,157,4094
1702,中国地方政府间竞争下的区域市场整合,皮建才,经济研究,2008-03-20,期刊,162,3574
1703,股权分置对中国资本市场实证研究的影响及模型修正,杨丹 魏韫新 叶建明,经济研究,2008-03-20,期刊,96,4345
1704,我国商业银行X效率研究——基于DEA三阶段模型的实证分析,黄宪 余丹 杨柳,数量经济技术经济研究,2008-07-05,期刊,244,3211
1705,财政政策与货币政策对私人投资的影响研究——基于有向无环图的应用分析,杨子晖,经济研究,2008-05-20,期刊,105,3449
1706,机构投资者、知情人交易和市场效率——来自中国资本市场的实证证据,侯宇 叶冬艳,金融研究,2008-04-25,期刊,145,2868
1707,控制权收益悖论与超控制权收益——对大股东侵害小股东利益的一个新的理论解释,刘少波,经济研究,2007-02-20,期刊,390,7093
1708,不完全理性、投资者情绪与封闭式基金之谜,伍燕然 韩立岩,经济研究,2007-03-20,期刊,353,5916
1709,政府补贴动机及其效果的实证研究——来自中国上市公司的经验证据,唐清泉 罗党论,金融研究,2007-06-25,期刊,283,4856
1710,我国上市公司信息披露透明度与证券分析师预测,方军雄,金融研究,2007-06-25,期刊,267,5771
1711,流动性、流动性过剩与货币政策,彭兴韵,经济研究,2007-11-20,期刊,144,4238
1712,中国出口汇率传递率和盯市能力的实证研究,陈学彬 李世刚 芦东,经济研究,2007-12-20,期刊,198,2461
1713,生产者服务业发展与制造业效率提升:基于地区和行业面板数据的经验分析,江静 刘志彪 于明超,世界经济,2007-08-10,期刊,431,5439
1714,盈余管理程度的估计模型与经验证据:一个综述,吴联生 王亚平,经济研究,2007-08-20,期刊,244,9444
1715,中国城市人力资本的估算,朱平芳 徐大丰,经济研究,2007-09-20,期刊,182,5092
1716,中国贸易顺差中是否有热钱，有多少?,唐旭 梁猛,金融研究,2007-08-25,期刊,161,3289
1717,管理层业绩报酬敏感度、内部现金流与企业投资行为——对自由现金流和信息不对称理论的一个检验,支晓强 童盼,会计研究,2007-10-15,期刊,233,5185
1718,区域竞争、土地出让与地方财政效应:基于1999~2003年中国地级城市面板数据的分析,陶然 袁飞 曹广忠,世界经济,2007-10-10,期刊,264,4548
1719,非竞争型投入占用产出模型及其应用——中美贸易顺差透视,刘遵义 陈锡康 杨翠红 Leonard K.Cheng K.C.Fung Yun-Wing Sung 祝坤福 裴建锁 唐志鹏,中国社会科学,2007-09-10,期刊,210,3082
1720,关于在财务会计中采用公允价值的探讨,葛家澍,会计研究,2007-11-15,期刊,473,9958
1721,1996-2005年中国商业银行的效率评价——基于成本效率和利润效率的实证分析,杨大强 张爱武,金融研究,2007-12-25,期刊,229,3549
1722,能源效率及其影响因素:基于DEA的实证分析,魏楚 沈满洪,管理世界,2007-08-15,期刊,618,9384
1723,我国中小企业融资问题研究,尹丹莉,天津财经大学,2009-05-01,博士,98,40335
1724,中国职工心理资本内容结构及其与态度行为变量关系实证研究,惠青山,暨南大学,2009-06-08,博士,111,4776
1725,我国城镇化进程中的失地农民问题研究,刘晓霞,东北师范大学,2009-05-01,博士,99,12089
1726,国外文化产业发展比较研究,霍步刚,东北财经大学,2009-06-06,博士,86,16156
1727,新经济地理学视角下的生产性服务业集聚研究,陈国亮,浙江大学,2010-06-01,博士,63,5280
1728,工商管理学科演进与前沿热点的可视化分析,侯剑华,大连理工大学,2009-06-01,博士,95,9753
1729,中国PPP项目风险公平分担,柯永建,清华大学,2010-06-01,博士,49,5954
1730,基于网络和信任理论的消费者在线口碑传播实证研究,陈蓓蕾,浙江大学,2008-04-01,博士,206,11871
1731,外汇资产、基础货币供应与货币内生性——基于央行资产负债表的分析,黄武俊 陈漓高,财经研究,2010-01-03,期刊,64,2553
1732,我国全要素能源效率及其收敛性,李国璋 霍宗杰,中国人口.资源与环境,2010-01-15,期刊,95,1342
1733,边远贫困地区民族村寨旅游发展的省思——以贵州西江千户苗寨为中心的考察,何景明,旅游学刊,2010-02-06,期刊,78,2498
1734,中国房地产价格波动与宏观经济——基于SVAR模型的研究,赵昕东,经济评论,2010-01-15,期刊,96,3813
1735,智能电网的本质动因和技术需求,姚建国 赖业宁,电力系统自动化,2010-01-25,期刊,109,1901
1736,收入、健康与医疗保险对老年人幸福感的影响,亓寿伟 周少甫,公共管理学报,2010-01-20,期刊,68,3018
1737,浙江省旅游产业关联与产业波及效应分析,崔峰 包娟,旅游学刊,2010-03-06,期刊,67,1998
1738,个人-组织匹配、工作满意度与员工离职意向关系的实证研究,王忠 张琳,管理学报,2010-03-15,期刊,130,3880
1739,信任和感知风险对消费者网络购买意愿的实证研究,赵冬梅 纪淑娴,数理统计与管理,2010-03-22,期刊,109,4090
1740,环境不确定性对盈余管理的影响,申慧慧,审计研究,2010-01-28,期刊,70,1941
1741,公共服务外包决策的影响因素研究,刘波 崔鹏鹏 赵云云,公共管理学报,2010-04-20,期刊,63,3039
1742,中国高技术产业创新效率研究——基于SFA方法的实证分析,韩晶,科学学研究,2010-03-15,期刊,186,3392
1743,我国地方政府债务风险和对策,贾康 刘微 张立承 石英华 孙洁,经济研究参考,2010-03-06,期刊,102,4271
1744,严格遵守会计准则  提供高质量财务报告  认真履行社会责任,刘玉廷,会计研究,2010-01-15,期刊,48,2356
1745,对人力资源会计研究困境与出路的思考,吴泷,会计研究,2010-01-15,期刊,47,5042
1746,我国制造业的规模经济效益影响因素分析,袁桂秋 张玲丹,数量经济技术经济研究,2010-03-05,期刊,35,1838
1747,银行业市场结构与中小企业的生成:来自中国1995～2006年的证据,雷震 彭欢,世界经济,2010-03-10,期刊,35,1883
1748,政府干预、政治关联与权益资本成本,肖浩 夏新平,管理学报,2010-06-15,期刊,91,1897
1749,外商直接投资对中国环境的影响与区域差异——基于省际面板数据和动态面板数据模型的异质性分析,苏振东 周玮庆,世界经济研究,2010-06-25,期刊,70,2758
1750,管理认知与动态环境下企业竞争优势:万和集团案例研究,尚航标 黄培伦,南开管理评论,2010-06-08,期刊,45,1943
1751,中国30个省市对外贸易的集聚效应和辐射效应研究,魏浩,世界经济,2010-04-10,期刊,32,1790
1752,美国征收碳关税对中国的影响:基于可计算一般均衡模型的分析,鲍勤 汤铃 杨列勋,管理评论,2010-06-25,期刊,106,3023
1753,网上至移动环境下的信任转移模型及其实证研究,林家宝 鲁耀斌 章淑婷,南开管理评论,2010-06-08,期刊,52,1475
1754,京沪入境旅游流网络结构特征分析,吴晋峰 潘旭莉,地理科学,2010-06-15,期刊,64,1172
1755,古村落旅游地游线固化的路径依赖——世界遗产地西递、宏村实证分析,徐红罡 吴悦芳 彭丽娟,地理研究,2010-07-15,期刊,32,2208
1756,我国个人所得税改革问题研究——兼论“起征点”问题合理解决的思路,贾康 梁季,财政研究,2010-04-05,期刊,100,5220
1757,可持续发展评价指标体系研究综述,曹斌 林剑艺 崔胜辉,环境科学与技术,2010-03-15,期刊,99,6506
1758,智能电网及其关键技术综述,李乃湖 倪以信 孙舒捷 姚美齐,南方电网技术,2010-06-20,期刊,85,2723
1759,我国制造业不同子行业与物流业联动发展协调度实证研究——基于灰色关联模型,王珍珍 陈功玉,上海财经大学学报,2010-06-20,期刊,91,2145
1760,中国社区参与旅游发展研究述评,刘丽梅 吕君,地理科学进展,2010-08-15,期刊,42,2399
