序号,题名,作者,来源,发表时间,数据库,被引,下载
954,迁移、自选择与收入分配——来自中国城乡的证据,邢春冰,经济学(季刊),2010-01-15,期刊,45,2372
955,从“民工荒”到“返乡潮”:中国的刘易斯拐点到来了吗?,侯东民 王德文 白南生 钱文荣 谢长青 周祝平,人口研究,2009-03-29,期刊,86,4753
956,中国城市化与经济发展水平关系的国际比较,陈明星 陆大道 查良松,地理研究,2009-03-15,期刊,147,4071
957,美国内部控制审计的制度变迁及其启示,张龙平 陈作习 宋浩,会计研究,2009-02-15,期刊,231,6827
958,居民地方感对区域旅游发展支持度影响——以九寨沟旅游核心社区为例,许振晓 张捷 Geoffrey Wall 曹靖 张宏磊,地理学报,2009-06-15,期刊,122,3659
959,农村土地流转的区域差异与影响因素——以江苏省为例,包宗顺 徐志明 高珊 周春芳,中国农村经济,2009-04-30,期刊,200,6657
960,风险态度与股票投资,李涛 郭杰,经济研究,2009-02-20,期刊,100,5581
961,需求响应视角下的智能电网,张钦 王锡凡 付敏 王建学,电力系统自动化,2009-09-10,期刊,205,3708
962,关系强度、关系资源与新企业绩效——基于行为视角的实证研究,杨俊 张玉利 杨晓非 赵英,南开管理评论,2009-08-08,期刊,123,3613
963,股权激励计划公告前的盈余管理——来自中国上市公司的经验证据,肖淑芳 张晨宇 张超 轩然,南开管理评论,2009-08-08,期刊,202,3830
964,证券投资收益的价值相关性与盈余管理研究,吴战篪 罗绍德 王伟,会计研究,2009-06-15,期刊,92,5163
965,公共支出结构、偏好匹配与财政分权,龚锋 卢洪友,管理世界,2009-01-15,期刊,189,4765
966,金字塔控制结构与股权制衡效应——基于中国上市公司的实证研究,毛世平,管理世界,2009-01-15,期刊,173,4418
967,论我国会计信息化发展战略,刘玉廷,会计研究,2009-06-15,期刊,107,5002
968,金融发展与城乡收入差距“倒U型”关系再检验——基于中国县域截面数据的实证分析,乔海曙 陈力,中国农村经济,2009-07-30,期刊,153,2565
969,国际农产品价格波动因素分析——基于时间序列的经济计量模型,胡冰川 徐枫 董晓霞,中国农村经济,2009-07-30,期刊,130,3567
970,劳动力选择性转移条件下的农业发展机制,郭剑雄 李志俊,经济研究,2009-05-20,期刊,83,2921
971,中国梯度发展模式下经济效率的增进——基于空间视角的分析,吕冰洋 余丹林,中国社会科学,2009-11-10,期刊,57,2925
972,内部审计质量与审计费用研究——基于中国上市公司的证据,王守海 杨亚军,审计研究,2009-09-28,期刊,120,5519
973,货币政策、企业成长与现金持有水平变化,祝继高 陆正飞,管理世界,2009-03-15,期刊,345,6113
974,FDI、产业结构变迁与中国的出口竞争力,文东伟 冼国明 马静,管理世界,2009-04-15,期刊,154,4271
975,多元化投资、代理问题与企业绩效,柳建华,金融研究,2009-07-25,期刊,83,2492
976,我国农村中小企业融资渠道选择的实证研究,田秀娟,金融研究,2009-07-25,期刊,70,5317
977,国际金融危机对我国出口贸易的影响——基于2007～2008年月度数据的实证研究,裴平 张倩 胡志锋,金融研究,2009-07-18,期刊,91,3191
978,中国经济的内外均衡与财税改革,樊纲 魏强 刘鹏,经济研究,2009-08-20,期刊,87,2681
979,中国多维贫困测量:估计和政策含义,王小林 Sabina Alkire,中国农村经济,2009-12-30,期刊,144,3071
980,环境规制、技术创新与中国火电行业的效率提升,白雪洁 宋莹,中国工业经济,2009-08-17,期刊,133,2364
981,企业自主创新能力评价体系研究,曹洪军 赵翔 黄少坚,中国工业经济,2009-09-17,期刊,94,3228
982,董事会独立性的交互效应和中国资本市场独立董事制度政策效果的评估,郑志刚 吕秀华,管理世界,2009-07-15,期刊,102,4222
983,人民币汇率水平和波动对国际贸易的影响——基于中美和中日贸易的实证研究,安辉 黄万阳,金融研究,2009-10-25,期刊,77,2763
984,利益输送、媒体监督与公司治理:五粮液案例研究,贺建刚 魏明海 刘峰,管理世界,2008-10-15,期刊,277,9778
985,经济发展方式转变与节能减排内在动力,蔡昉 都阳 王美艳,经济研究,2008-06-20,期刊,453,6965
986,中国农村改革三十年——制度经济学的分析,蔡昉,中国社会科学,2008-11-10,期刊,130,6517
987,政府偏好、公共品供给与转型中的财政分权,丁菊红 邓可斌,经济研究,2008-07-20,期刊,196,4703
988,公司治理影响公司财务风险吗?,于富生 张敏 姜付秀 任梦杰,会计研究,2008-10-15,期刊,253,5899
989,中国生产性服务业的水平、结构及影响——基于投入—产出法的国际比较研究,程大中,经济研究,2008-01-20,期刊,389,6747
990,政府干预、金字塔结构与地方国有上市公司投资,程仲鸣 夏新平 余明桂,管理世界,2008-09-15,期刊,405,4934
991,大贷款人角色:我国银行具有监督作用吗?,胡奕明 林文雄 李思琦 谢诗蕾,经济研究,2008-10-20,期刊,153,2544
992,我国农村留守儿童状况研究,段成荣 杨舸,人口研究,2008-05-29,期刊,322,15662
993,中国上市公司治理与企业技术创新关系的实证分析,冯根福 温军,中国工业经济,2008-07-17,期刊,370,5085
994,产品市场竞争与资本结构动态调整,姜付秀 屈耀辉 陆正飞 李焰,经济研究,2008-04-20,期刊,293,7391
995,改革开放30年中国流动人口社会保障的发展与挑战,郑秉文,中国人口科学,2008-10-01,期刊,162,3864
996,政府控制、经理薪酬与资本投资,辛清泉 林斌 王彦超,经济研究,2007-08-20,期刊,1346,17688
997,中国低碳生态城市发展战略,李迅 曹广忠 徐文珍 杨春志 宋峰 赵培红,城市发展研究,2010-01-26,期刊,143,6943
998,国际货币体系改革:背景、原因、措施及中国的参与,张明,国际经济评论,2010-01-27,期刊,62,3534
999,苏州市区信息通讯企业空间集聚与新企业选址,袁丰 魏也华 陈雯 金志丰,地理学报,2010-02-15,期刊,61,1638
1000,我国出口贸易、经济增长与碳排放关系的实证研究,许广月 宋德勇,国际贸易问题,2010-01-15,期刊,219,4310
1001,被世界关注的中国农民工——论中国特色的深度城市化,蔡昉,国际经济评论,2010-03-27,期刊,76,3153
1002,要素资本平衡表:一种新的内部资产负债表,罗福凯,中国工业经济,2010-02-17,期刊,89,1120
1003,旅游公共服务:内涵、特征与分类框架,李爽 黄福才 李建中,旅游学刊,2010-04-06,期刊,118,3190
1004,空间效率与区域协调发展战略选择,范剑勇 高人元 张雁,世界经济,2010-02-10,期刊,46,2571
1005,智能电网建设与电力市场发展,鲁刚 魏玢 马莉,电力系统自动化,2010-05-10,期刊,77,3769
1006,基于企业内外部网络视角的创新绩效多因素影响模型与实证研究,任胜钢 宋迎春 王龙伟 曹裕,中国工业经济,2010-04-17,期刊,52,2005
1007,城市轨道交通对房地产增值的时空效应,聂冲 温海珍 樊晓锋,地理研究,2010-05-15,期刊,63,1861
1008,资产注入、证券市场监管与绩效,季华 魏明海 柳建华,会计研究,2010-02-15,期刊,47,2917
1009,国内外城镇旅游研究综述,李柏文,旅游学刊,2010-06-06,期刊,79,4000
1010,重工业优先发展战略、城市化和城乡工资差距,陈斌开 林毅夫,南开经济研究,2010-02-22,期刊,134,3653
1011,房地产价格对货币政策动态响应的区域异质性——基于省际面板数据的实证分析,魏玮 王洪卫,财经研究,2010-06-03,期刊,91,2130
1012,保险发展、金融协同和经济增长——基于省级面板数据的研究,吴洪 赵桂芹,经济科学,2010-06-20,期刊,75,1679
1013,产业聚集、经济增长与地区差距——基于中国省级面板数据的实证研究,刘军 徐康宁,中国软科学,2010-07-28,期刊,90,2207
1014,金融危机背景下企业现金流运行中的政策影响研究,陈志斌 刘静,会计研究,2010-04-15,期刊,46,2474
1015,关系特征、资源获取与初创企业绩效关系实证研究,朱秀梅 费宇鹏,南开管理评论,2010-06-08,期刊,77,1993
1016,中国城市土地利用结构研究进展及展望,鲁春阳 杨庆媛 靳东晓 李新阳 文枫,地理科学进展,2010-07-15,期刊,58,3149
1017,关于调整经济结构促进持续发展的几个问题,李克强,求是,2010-06-01,期刊,247,2605
1018,中国家庭的资产组合选择:健康状况与风险偏好,雷晓燕 周月刚,金融研究,2010-01-25,期刊,64,3088
1019,基于转移矩阵的土地利用变化信息挖掘方法探讨,刘瑞 朱道林,资源科学,2010-08-15,期刊,106,2302
1020,地区差异、城市化与城乡收入差距,周少甫 亓寿伟 卢忠宝,中国人口.资源与环境,2010-08-15,期刊,86,1735
1021,农户采用不同属性技术的影响因素分析——基于9省(区)2110户农户的调查,唐博文 罗小锋 秦军,中国农村经济,2010-06-30,期刊,83,1128
1022,要素积累、偏向型技术进步与劳动收入占比,王永进 盛丹,世界经济文汇,2010-08-05,期刊,89,1656
1023,中国上市公司公司债发行公告效应的实证研究,付雷鸣 万迪昉 张雅慧,金融研究,2010-03-25,期刊,56,2523
1024,均衡城镇化:大都市与中小城市协调共进,辜胜阻 李华 易善策,人口研究,2010-09-29,期刊,58,1678
1025,中国消费者的顾客价值形成机制:以手机为对象的实证研究,张新安,管理世界,2010-01-15,期刊,53,3513
1026,机会窗口、逆向选择成本与股权融资偏好,束景虹,金融研究,2010-04-25,期刊,50,2438
1027,从中国股指期货境外的联动看我国股市定价权,封思贤 张兵 李心丹 汪慧建,金融研究,2010-04-25,期刊,45,2308
1028,近代中国经济学的发展——来自留学生博士论文的考察,邹进文,中国社会科学,2010-09-10,期刊,26,2495
1029,迈过“中等收入陷阱”的需求结构演变与产业结构调整,马晓河,宏观经济研究,2010-11-18,期刊,85,2645
1030,新农村建设的收入再分配效应,王震,经济研究,2010-06-20,期刊,35,2933
1031,宏观审慎视角下的最优货币政策框架,张亦春 胡晓,金融研究,2010-05-25,期刊,56,2172
1032,所有权、公司治理与财务报表重述,黄志忠 白云霞 李畅欣,南开管理评论,2010-10-08,期刊,60,2093
1033,计量经济学模型的功能与局限,李子奈 齐良书,数量经济技术经济研究,2010-09-05,期刊,33,4361
1034,北京山区耕地质量变化及未来趋势模拟,姜广辉 赵婷婷 段增强 张凤荣 霍荟阁 谭雪晶,农业工程学报,2010-10-31,期刊,75,1292
1035,我国集群跨越式升级的“跳板”战略研究,吴义爽 蔡宁,中国工业经济,2010-10-17,期刊,45,1262
1036,家族内部的权力偏离及其对治理效率的影响——对家族上市公司的研究,贺小刚 李新春 连燕玲 张远飞,中国工业经济,2010-10-17,期刊,36,1682
1037,一损俱损还是因祸得福?——企业社会责任声誉溢出效应研究,费显政 李陈微 周舒华,管理世界,2010-04-15,期刊,61,4377
1038,中国县域经济差异变化分析,张毅,中国农村经济,2010-11-30,期刊,48,1685
1039,中国省际贸易开放与经济增长的内生性研究,黄新飞 舒元,管理世界,2010-07-15,期刊,53,2620
1040,贫困山区不同类型农户对宅基地流转的认知与响应——基于重庆市云阳县568户农户调查,周婧 杨庆媛 张蔚 王宁 张凌华 杨逢渤,中国土地科学,2010-09-15,期刊,70,1807
1041,我国城乡收入差距与全要素生产率——基于省域数据的空间计量分析,许海平 王岳龙,金融研究,2010-10-25,期刊,34,2420
1042,证券内幕交易民事责任功能质疑,耿利航,法学研究,2010-11-23,期刊,40,1911
1043,契约执行效率能够影响FDI的区位分布吗?,盛丹 王永进,经济学(季刊),2010-07-31,期刊,34,1265
1044,中国住房改革对家庭耐用品消费的影响,尹志超 甘犁,经济学(季刊),2009-10-15,期刊,53,2060
1045,商业信用对信贷政策的抵消作用是反周期的吗?来自中国的证据,石晓军 张顺明 李杰,经济学(季刊),2009-10-15,期刊,56,1618
1046,东北地区产业结构演变的城市化响应机理与调控,刘艳军 李诚固,地理学报,2009-02-15,期刊,97,3604
1047,中国区域创新效率及其空间差异研究,史修松 赵曙东 吴福象,数量经济技术经济研究,2009-03-05,期刊,206,3180
1048,中国贸易增长的能源环境代价,张友国,数量经济技术经济研究,2009-01-05,期刊,167,2480
1049,中国东部沿海地区乡村发展类型及其乡村性评价,龙花楼 刘彦随 邹健,地理学报,2009-04-15,期刊,166,3103
1050,农民工留城与返乡意愿的影响因素分析,李强 龙文进,中国农村经济,2009-02-28,期刊,195,3838
1051,美国内部控制实证研究:回顾与启示,李享,审计研究,2009-01-28,期刊,193,4779
1052,利益相关者价值取向的企业绩效评价——绩效三棱镜的应用案例,温素彬 黄浩岚,会计研究,2009-04-15,期刊,137,3610
1053,会计信息质量与公司资本配置效率——来自我国上市公司的经验证据,李青原,南开管理评论,2009-04-08,期刊,180,3998
1054,中国经济增长质量的测度,钞小静 惠康,数量经济技术经济研究,2009-06-05,期刊,145,2997
1055,中国GDP的趋势周期分解与随机冲击的持久效应,王少平 胡进,经济研究,2009-04-20,期刊,84,3138
1056,中国经济增长与能源消费强度差异的收敛性及机理分析,齐绍洲 云波 李锴,经济研究,2009-04-20,期刊,102,4730
1057,中国城市全要素生产率的动态实证分析:1990—2006——基于DEA模型的Malmquist指数方法,刘秉镰 李清彬,南开经济研究,2009-06-22,期刊,186,4861
1058,中国地方政府间支出竞争研究——基于中国省级面板数据的经验证据,李涛 周业安,管理世界,2009-02-15,期刊,171,3992
1059,社会网络是否有助于提高农民工的工资水平?,章元 陆铭,管理世界,2009-03-15,期刊,176,4791
1060,我国银行小企业信贷模式与风险管理研究——基于银行问卷调研的分析,陈忠阳 郭三野 刘吕科,金融研究,2009-05-25,期刊,77,3110
1061,区域制造业规模经济、技术变化与全要素生产率——产业集聚的影响分析,朱英明,数量经济技术经济研究,2009-10-05,期刊,79,3299
1062,碳关税、低碳经济和中美贸易再平衡,夏先良,国际贸易,2009-11-20,期刊,133,4889
1063,中国改革开放以来的全要素生产率变动及其分解(1978～2006年)——基于省际面板数据的Malmquist指数分析,傅勇 白龙,金融研究,2009-07-25,期刊,76,2549
1064,基于R~2的中国股市私有信息套利分析,冯用富 董艳 袁泽波 杨仁眉,经济研究,2009-08-20,期刊,81,2523
1065,基于省际面板的财政支出与通货膨胀关系研究,赵文哲 周业安,经济研究,2009-10-20,期刊,51,3550
1066,中国工业重新配置与劳动力流动趋势,蔡昉 王美艳 曲玥,中国工业经济,2009-08-17,期刊,89,2167
1067,劳动报酬、劳动生产率与劳动力成本优势——对2000—2007年中国制造业企业的经验研究,都阳 曲玥,中国工业经济,2009-05-17,期刊,115,3129
1068,交通运输、经济增长及溢出效应——基于中国省际数据空间经济计量的结果,胡鞍钢 刘生龙,中国工业经济,2009-05-17,期刊,131,3149
1069,企业规模与技术创新倒U关系的形成机制与动态拓展,高良谋 李宇,管理世界,2009-08-15,期刊,99,3849
1070,中国转型期商业银行的公司治理与绩效研究,赵昌文 杨记军 夏秋,管理世界,2009-07-15,期刊,113,3603
1071,合作博弈框架下企业内部权力的分配,卢周来,经济研究,2009-12-20,期刊,46,2686
1072,地方政府公共治理与国有控股上市公司控制权转移——1996～2004年深圳市属上市公司重组案例研究,谭劲松 郑国坚 彭松,管理世界,2009-10-15,期刊,63,2931
1073,转移支付与地方财政收支决策——基于省级面板数据的实证研究,李永友 沈玉平,管理世界,2009-11-15,期刊,82,3082
1074,非线性泰勒规则在我国货币政策操作中的实证研究,中国人民银行营业管理部课题组 杨国中 姜再勇 刘宁,金融研究,2009-12-25,期刊,65,1589
1075,加工贸易经济中的汇率传递:一个DSGE模型分析,黄志刚,金融研究,2009-11-25,期刊,60,2236
1076,商业银行竞争力及其评价研究,杨家才,金融研究,2008-12-25,期刊,110,4864
1077,出口与中国本土企业生产率——基于江苏制造业企业的实证分析,张杰 李勇 刘志彪,管理世界,2008-11-15,期刊,166,3035
1078,企业演化:中国工业生产率增长的重要途径,李玉红 王皓 郑玉歆,经济研究,2008-06-20,期刊,212,3201
1079,独立董事监督力与盈余稳健性——基于中国上市公司的实证研究,赵德武 曾力 谭莉川,会计研究,2008-09-15,期刊,216,4161
1080,产业集聚的集聚效应——以长江三角洲次区域为例的理论和实证分析,陈建军 胡晨光,管理世界,2008-06-15,期刊,196,7277
1081,企业动态能力构建路径分析:基于创业导向和组织学习的视角,焦豪 魏江 崔瑜,管理世界,2008-04-15,期刊,260,6273
1082,教育投入比与地区经济增长差异,于凌云,经济研究,2008-10-20,期刊,108,4066
1083,高层管理者政治网络与企业多元化战略:社会资本视角——基于我国上市公司面板数据的实证分析,巫景飞 何大军 林(日韦) 王云,管理世界,2008-08-15,期刊,269,5128
1084,国企分红、在职消费与公司业绩,罗宏 黄文华,管理世界,2008-09-15,期刊,341,5050
1085,独立董事与上市公司盈余信息质量,胡奕明 唐松莲,管理世界,2008-09-15,期刊,272,5471
1086,市场竞争还是性别歧视——收入性别差异扩大趋势及其原因解释,李春玲 李实,社会学研究,2008-03-20,期刊,149,4963
1087,2006年沪市公司内部控制信息披露研究,杨有红 汪薇,会计研究,2008-03-15,期刊,769,7855
1088,中国出口贸易中的载能量及碳排放量分析,刘强 庄幸 姜克隽 韩文科,中国工业经济,2008-08-17,期刊,356,4054
1089,中国为什么拥有了良好的基础设施?,张军 高远 傅勇 张弘,经济研究,2007-03-20,期刊,879,12954
1090,改革以来全国总体基尼系数的演变及其城乡分解,程永宏,中国社会科学,2007-07-10,期刊,420,8214
1091,能源效率的七类测度指标及其测度方法,魏一鸣 廖华,中国软科学,2010-01-28,期刊,131,2825
1092,环境库兹涅茨曲线理论及研究的批评综论,钟茂初 张学刚,中国人口.资源与环境,2010-02-15,期刊,113,2308
1093,新疆伊犁河流域生态服务价值对土地利用变化的响应,孙慧兰 李卫红 陈亚鹏 徐长春,生态学报,2010-02-23,期刊,102,1532
1094,中国房地产市场波动对宏观经济波动的影响研究,唐志军 徐会军 巴曙松,统计研究,2010-02-15,期刊,131,5039
1095,农村居民点用地整理的分区评价——以河北省为例,刘玉 刘彦随 王介勇,地理研究,2010-01-15,期刊,77,1877
1096,媒体注意力会引起股票的异常收益吗?——来自中国股票市场的经验证据,饶育蕾 彭叠峰 成大超,系统工程理论与实践,2010-02-15,期刊,167,2744
1097,生命周期视角下的股权制衡与企业价值,佟岩 陈莎莎,南开管理评论,2010-02-08,期刊,110,2224
1098,创意转向与创意旅游,赵玉宗 潘永涛 范英杰 孙艺惠 卢松,旅游学刊,2010-03-06,期刊,98,3061
1099,农村劳动力外出务工对留守老人生活照料的影响研究,贺聪志 叶敬忠,农业经济问题,2010-03-23,期刊,84,3089
1100,经济增长与收入分配不平等的倒U型多拐点测度研究,许冰 章上峰,数量经济技术经济研究,2010-02-05,期刊,53,2314
1101,当前农业和农村经济形势与“三农”面临的挑战,陈锡文,中国农村经济,2010-01-30,期刊,104,3069
1102,全球低碳经济潮流与中国的响应对策,何建坤 周剑 刘滨 孙振清,世界经济与政治,2010-04-14,期刊,54,2850
1103,中国上市公司环境信息披露的现状研究——以2007年和2008年沪市A股制造业上市公司为例,卢馨 李建明,审计与经济研究,2010-05-10,期刊,171,2926
1104,低碳经济视角下的省域竞争研究,胡志伟 刘勇,中国工业经济,2010-04-17,期刊,48,2487
1105,投资者保护与控股股东资产偏好,罗琦 王寅,会计研究,2010-02-15,期刊,53,2807
1106,经典扎根理论及其精神对中国管理研究的现实价值,贾旭东 谭新辉,管理学报,2010-05-15,期刊,131,3568
1107,通货膨胀机理变化及政策应对,张晓慧 纪志宏 李斌,世界经济,2010-03-10,期刊,45,1709
1108,企业纵向一体化的决定因素与生产效率——来自我国制造业企业的经验证据,李青原 唐建新,南开管理评论,2010-06-08,期刊,64,2080
1109,电力市场中需求响应市场与需求响应项目研究,赵鸿图 朱治中 于尔铿,电网技术,2010-05-05,期刊,87,1689
1110,基于DEA模型的企业投资效率评价,王坚强 阳建军,科研管理,2010-07-20,期刊,81,3464
1111,模块化、模块再整合与产业格局的重构——以“山寨”手机的崛起为例,李晓华,中国工业经济,2010-07-17,期刊,46,1618
1112,行业特征与现金股利政策——基于2004-2008年中国上市公司的实证研究,权小锋 滕明慧 吴世农,财经研究,2010-08-03,期刊,58,2840
1113,基于农户意愿的农村居民点整理潜力测算与优化,孔雪松 刘艳芳 邹亚锋 陈奕云,农业工程学报,2010-08-31,期刊,91,1266
1114,上海市工业碳排放总量与碳生产率关系,谌伟 诸大建 白竹岚,中国人口.资源与环境,2010-09-15,期刊,76,1315
1115,碳金融全球布局与中国的对策,刘倩 王遥,中国人口.资源与环境,2010-08-15,期刊,57,2678
1116,国外低碳经济研究动向分析,倪外 曾刚,经济地理,2010-08-26,期刊,79,4628
1117,东亚产业关联的研究方法与现状——一个国际/国家间投入产出模型的综述,李晓 张建平,经济研究,2010-04-20,期刊,37,3797
1118,金融危机中的信息机制:一个新的视角,陈雨露 马勇 李濛,金融研究,2010-03-25,期刊,46,2326
1119,机构投资者与公司价值关系研究——来自上市公司要约收购的证据,龙振海,南开管理评论,2010-08-08,期刊,58,1690
1120,基于防范财政风险视角的中国政府会计改革探讨,肖鹏,会计研究,2010-06-15,期刊,59,2183
1121,中国省区城镇化的核心驱动力演变与过程模型,曹广忠 刘涛,中国软科学,2010-09-28,期刊,73,2515
1122,中国农业能源消费碳排放因素分解实证分析——基于LMDI模型,李国志 李宗植,农业技术经济,2010-10-26,期刊,116,1771
1123,我国货币流动性与通货膨胀的定量研究——基于时变参数模型的实证,李占风 陈妤,数量经济技术经济研究,2010-08-05,期刊,41,1683
1124,新会计准则对现金股利和会计盈余关系影响的研究,娄芳 李玉博 原红旗,管理世界,2010-01-15,期刊,62,4288
1125,政治关系如何影响公司价值:融资约束与行业竞争的证据,徐龙炳 李科,财经研究,2010-10-03,期刊,65,1963
1126,人力资本、研发投入与对外直接投资的逆向技术溢出,李梅,世界经济研究,2010-10-25,期刊,79,1753
1127,“十二五”时期农业和农村发展面临的挑战与选择,农业部农村经济研究中心分析研究小组 宋洪远 张红奎 方华 张恒春 赵海,中国农村经济,2010-08-30,期刊,40,1688
1128,关于科技金融理论、实践与政策的思考,房汉廷,中国科技论坛,2010-11-05,期刊,235,4540
1129,激进股利政策的影响因素及其经济后果,陆正飞 王春飞 王鹏,金融研究,2010-05-25,期刊,38,3910
1130,国有公司的信贷优惠:信贷干预还是隐性担保?——基于信用贷款的实证检验,袁淳 荆新 廖冠民,会计研究,2010-08-15,期刊,55,1726
1131,战略委员会与上市公司过度投资行为,覃家琦,金融研究,2010-05-25,期刊,43,1805
1132,中国上市公司收购兼并的市场预期绩效实现了吗?,翟进步 贾宁 李丹,金融研究,2010-05-25,期刊,43,2511
1133,中国城镇化进程、面临问题及其总体布局,马晓河 胡拥军,改革,2010-10-15,期刊,140,7385
1134,中国城镇化的若干重大问题与未来总体战略构想,马晓河 胡拥军,农业经济问题,2010-11-23,期刊,47,1853
1135,中国战略石油储备的最优规模,林伯强 杜立民,世界经济,2010-08-10,期刊,33,1853
1136,发展中大国人力资本综合优势与经济增长——基于异质性与适应性视角的研究,欧阳峣 刘智勇,中国工业经济,2010-11-17,期刊,41,1332
1137,外资技术转移与内资经济增长质量——基于中国区域面板数据的检验,沈坤荣 傅元海,中国工业经济,2010-11-17,期刊,35,1709
1138,外汇储备币种结构管理:国际研究综述,徐永林 张志超,世界经济,2010-09-10,期刊,29,1687
1139,政府会计信息有用性及需求情况调查报告,赵西卜 王建英 王彦 曹越,会计研究,2010-09-15,期刊,32,2856
1140,环境约束下中国区域工业技术效率与生产率及其影响因素实证研究,王兵 王丽,南方经济,2010-11-15,期刊,102,1466
1141,“土地财政”规模估算及影响因素研究,杨圆圆,财贸经济,2010-10-10,期刊,101,2132
1142,纳入公平偏好的经济学研究:理论与实证,韦倩,经济研究,2010-09-20,期刊,33,2277
1143,资源禀赋、官员交流与经济增长,杨海生 罗党论 陈少凌,管理世界,2010-05-15,期刊,60,2747
1144,退休会影响健康吗?,雷晓燕 谭力 赵耀辉,经济学(季刊),2010-07-31,期刊,38,2604
1145,经济增长与农村反贫困,夏庆杰 宋丽娜 Simon Appleton,经济学(季刊),2010-04-30,期刊,35,2035
